{
  "schema_version": "1.3.3",
  "plan_id": "PLAN-1",
  "task_id": "T3.1",
  "created_at": "2026-10-24T00:00:00+00:00",
  "write_scope": ["src/"],
  "changes": [
    {
      "path": "src/Example.tsx",
      "action": "modify",
      "sha256_before": "0123456789abcdef0123456789abcdef0123456789abcdef0123456789abcdef",
      "content": "export const Example = () => null;\n"
    }
  ]
}
